{
  "$schema": "https://json-schema.org/draft/2020-12/schema",
  "$id": "https://neutron.build/contracts/data/schema-v2.json",
  "title": "Neutron schema document v2",
  "description": "Cross-language schema contract shared by the TypeScript exporter and the Go CLI. A document is a single JSON object describing a PostgreSQL schema state (desired or introspected). The shape here is normative for structure; cross-object rules (identity uniqueness, foreign-key resolution, codec/type consistency, capability requirements) are enforced by the reference validators in cli/internal/db and contracts/data/consumer.ts, and pinned by the golden fixtures in contracts/data/golden/. Canonical serialization and hashing are defined by contracts/data/CANONICAL.md. Unknown versions, unknown fields, unknown types and duplicate identities are rejected. Objects this contract cannot represent (extension-owned tables, unsupported catalog structures) are never flattened: they appear only as opaque inventory entries.",
  "type": "object",
  "properties": {
    "version": {
      "const": 2,
      "description": "Explicit format version. Documents declaring any other value are rejected with code unknown-version."
    },
    "dialect": {
      "const": "postgresql",
      "description": "SQL dialect the document targets. v2 targets PostgreSQL only."
    },
    "capabilities": {
      "type": "array",
      "items": { "enum": ["pgvector", "nucleus"] },
      "uniqueItems": true,
      "description": "Capabilities the document requires (engine extension or Nucleus feature). Unordered set: canonical form sorts it. columns of type vector require pgvector or nucleus here."
    },
    "schemas": {
      "type": "array",
      "items": { "$ref": "#/$defs/schemaDef" },
      "description": "SQL namespaces (schema objects). Every identity.schema anywhere in the document must be declared here. Unordered set: canonical form sorts by name."
    },
    "tables": {
      "type": "array",
      "items": { "$ref": "#/$defs/table" },
      "description": "Tables. The array order in the source document is presentation only: the set is unordered for identity and hashing, and canonical form sorts by (schema, name) and sorts each table's constraints and indexes. Ordering that is semantic lives inside ordered tuples (each table's columns, constraint columns, index key parts)."
    },
    "enums": {
      "type": "array",
      "items": { "$ref": "#/$defs/enumDef" },
      "description": "Enum types. Field is required even when empty so the shape can represent documents without enums unambiguously. values are an ordered tuple: PostgreSQL enum order is semantic."
    },
    "views": {
      "type": "array",
      "items": { "$ref": "#/$defs/view" },
      "description": "Views. Field is required even when empty. definition is stored verbatim; expression equivalence is a planner concern, not a contract concern."
    },
    "opaque": {
      "type": "array",
      "items": { "$ref": "#/$defs/opaqueEntry" },
      "description": "Read-only inventory of catalog objects this contract cannot represent: extension-owned tables, unsupported structures, external objects. Never flattened into tables. Tools must not generate DDL from these entries."
    }
  },
  "required": ["version", "dialect", "capabilities", "schemas", "tables", "enums", "views", "opaque"],
  "additionalProperties": false,
  "$defs": {
    "name": {
      "type": "string",
      "minLength": 1,
      "pattern": "^[^\\u0000-\\u001F\\u007F]+$",
      "description": "Identifier or object name. Must be non-empty and free of control characters (C0 including NUL, and DEL). Quoting rules are the producer's concern; the contract stores names verbatim."
    },
    "sqlText": {
      "type": "string",
      "minLength": 1,
      "pattern": "^[^\\u0000]+$",
      "description": "SQL text (expression, predicate, view definition, reason). Stored and hashed verbatim; must be non-empty and free of NUL. No statement separator is permitted in expression positions (enforced by validators for single expressions); a view definition is one statement, so a separator may only end it (enforced by validators, which treat separators inside literals, quoted identifiers, dollar quotes and comments as text)."
    },
    "identity": {
      "type": "object",
      "properties": {
        "schema": { "$ref": "#/$defs/name" },
        "name": { "$ref": "#/$defs/name" }
      },
      "required": ["schema", "name"],
      "additionalProperties": false,
      "description": "Schema-qualified object identity."
    },
    "schemaDef": {
      "type": "object",
      "properties": {
        "name": { "$ref": "#/$defs/name" }
      },
      "required": ["name"],
      "additionalProperties": false
    },
    "columnType": {
      "type": "object",
      "description": "Column type with parameters and codec metadata. Type names are PostgreSQL pg_catalog typnames (introspection-faithful). Arrays are represented with array: true on the element type description.",
      "properties": {
        "name": {
          "enum": ["bool", "int2", "int4", "int8", "float4", "float8", "numeric", "text", "varchar", "timestamp", "timestamptz", "date", "bytea", "uuid", "json", "jsonb", "vector", "tsvector", "enum"],
          "description": "Base type name. enum requires the enum reference field and resolves to a declared enum object."
        },
        "params": {
          "type": "object",
          "properties": {
            "length": { "type": "integer", "minimum": 1 },
            "precision": { "type": "integer", "minimum": 1, "maximum": 1000 },
            "scale": { "type": "integer", "minimum": 0 },
            "dimensions": { "type": "integer", "minimum": 1 }
          },
          "additionalProperties": false,
          "description": "Type parameters. Allowed keys per type (enforced by validators): varchar: length; numeric: precision, scale (scale requires precision, scale <= precision); timestamp/timestamptz: precision 0..6; vector: dimensions (required). All values are plain integers."
        },
        "array": {
          "type": "boolean",
          "default": false,
          "description": "True when the column is an array of the base type. When true, codec must be array."
        },
        "codec": {
          "enum": ["number", "bigint", "decimal-string", "date-string", "timestamp-string", "timestamptz-string", "boolean", "string", "uuid", "binary", "json", "enum", "array", "vector", "tsvector"],
          "description": "Codec metadata: how values of this column are represented on the wire (program README section 3.3). Validators enforce the default codec per type: bool=boolean, int2/int4/float4/float8=number, int8=bigint, numeric=decimal-string, text/varchar=string, timestamp=timestamp-string, timestamptz=timestamptz-string, date=date-string, bytea=binary, uuid=uuid, json/jsonb=json, vector=vector, enum=enum, arrays=array."
        },
        "enum": { "$ref": "#/$defs/identity" }
      },
      "required": ["name", "codec"],
      "additionalProperties": false
    },
    "columnDefault": {
      "oneOf": [
        {
          "type": "object",
          "properties": {
            "kind": { "const": "literal" },
            "sql": {
              "type": "string",
              "pattern": "^('([^']|'')*'(::[A-Za-z_][A-Za-z0-9_]*(\\.[A-Za-z_][A-Za-z0-9_]*)?(\\[\\])*)?|-?(\\d+(\\.\\d*)?|\\.\\d+)([eE][+-]?\\d+)?|true|false|null)$",
              "description": "Exactly one SQL literal token, optionally cast: a single-quoted string (with '' doubling), a numeric literal, true, false or null. Text that looks like an expression (now(), gen_random_uuid()) must be tagged expression instead."
            }
          },
          "required": ["kind", "sql"],
          "additionalProperties": false
        },
        {
          "type": "object",
          "properties": {
            "kind": { "const": "expression" },
            "sql": { "$ref": "#/$defs/sqlText" }
          },
          "required": ["kind", "sql"],
          "additionalProperties": false
        },
        {
          "type": "object",
          "description": "GENERATED {ALWAYS | BY DEFAULT} AS IDENTITY. Valid only on integer columns (int2/int4/int8).",
          "properties": {
            "kind": { "const": "identity" },
            "generated": { "enum": ["always", "by default"] },
            "sequence": { "$ref": "#/$defs/identity" }
          },
          "required": ["kind", "generated"],
          "additionalProperties": false
        },
        {
          "type": "object",
          "description": "Sequence-backed default (nextval), the serial representation. Valid only on integer columns. The sequence schema must be declared in schemas.",
          "properties": {
            "kind": { "const": "sequence" },
            "sequence": { "$ref": "#/$defs/identity" }
          },
          "required": ["kind", "sequence"],
          "additionalProperties": false
        }
      ],
      "description": "Defaults are tagged values. The tag is authoritative: 'now()' as a literal string and now() as an expression are different documents with different hashes."
    },
    "column": {
      "type": "object",
      "description": "Table column. Absence of default means no default. Primary-key columns must declare notNull: true explicitly (validators reject otherwise; v2 performs no silent normalization). A generated column carries its stored expression in generated and never a default; virtual generated columns are not representable (explicitly unsupported).",
      "properties": {
        "name": { "$ref": "#/$defs/name" },
        "type": { "$ref": "#/$defs/columnType" },
        "notNull": { "type": "boolean" },
        "default": { "$ref": "#/$defs/columnDefault" },
        "generated": {
          "type": "object",
          "properties": {
            "expression": { "$ref": "#/$defs/sqlText" }
          },
          "required": ["expression"],
          "additionalProperties": false,
          "description": "GENERATED ALWAYS AS (expression) STORED. Database-computed; never written."
        }
      },
      "required": ["name", "type", "notNull"],
      "additionalProperties": false
    },
    "constraint": {
      "type": "object",
      "description": "Table-level constraint. Constraint columns are an ordered tuple: composite key column order is semantic and preserved verbatim by canonicalization.",
      "oneOf": [
        {
          "properties": {
            "name": { "$ref": "#/$defs/name" },
            "type": { "const": "primary-key" },
            "columns": { "type": "array", "items": { "$ref": "#/$defs/name" }, "minItems": 1 },
            "deferrable": { "type": "boolean" },
            "initiallyDeferred": { "type": "boolean" }
          },
          "required": ["name", "type", "columns"],
          "additionalProperties": false
        },
        {
          "properties": {
            "name": { "$ref": "#/$defs/name" },
            "type": { "const": "unique" },
            "columns": { "type": "array", "items": { "$ref": "#/$defs/name" }, "minItems": 1 },
            "deferrable": { "type": "boolean" },
            "initiallyDeferred": { "type": "boolean" }
          },
          "required": ["name", "type", "columns"],
          "additionalProperties": false
        },
        {
          "properties": {
            "name": { "$ref": "#/$defs/name" },
            "type": { "const": "check" },
            "expression": { "$ref": "#/$defs/sqlText" },
            "deferrable": { "type": "boolean" },
            "initiallyDeferred": { "type": "boolean" }
          },
          "required": ["name", "type", "expression"],
          "additionalProperties": false
        },
        {
          "properties": {
            "name": { "$ref": "#/$defs/name" },
            "type": { "const": "foreign-key" },
            "columns": { "type": "array", "items": { "$ref": "#/$defs/name" }, "minItems": 1 },
            "references": {
              "type": "object",
              "properties": {
                "table": { "$ref": "#/$defs/identity" },
                "columns": { "type": "array", "items": { "$ref": "#/$defs/name" }, "minItems": 1 },
                "onDelete": { "enum": ["cascade", "restrict", "no action", "set null", "set default"] },
                "onUpdate": { "enum": ["cascade", "restrict", "no action", "set null", "set default"] },
                "match": { "enum": ["simple", "full", "partial"] }
              },
              "required": ["table", "columns"],
              "additionalProperties": false,
              "description": "Reference target tuples are ordered and name-based: the referenced column names need not match the referencing column names (renamed targets are representable). The target tuple must be covered by a primary-key or unique constraint on the referenced table (validators enforce)."
            },
            "deferrable": { "type": "boolean" },
            "initiallyDeferred": { "type": "boolean" }
          },
          "required": ["name", "type", "columns", "references"],
          "additionalProperties": false
        }
      ]
    },
    "indexDef": {
      "type": "object",
      "description": "Index with schema-global identity. key is an ordered tuple of key parts; include is an unordered set (canonical form sorts it).",
      "properties": {
        "identity": { "$ref": "#/$defs/identity" },
        "unique": { "type": "boolean" },
        "method": { "enum": ["btree", "hash", "gin", "gist", "spgist", "brin", "hnsw", "ivfflat"] },
        "key": {
          "type": "array",
          "minItems": 1,
          "items": {
            "oneOf": [
              {
                "type": "object",
                "properties": {
                  "column": { "$ref": "#/$defs/name" },
                  "order": { "enum": ["asc", "desc"] },
                  "nulls": { "enum": ["first", "last"] },
                  "opclass": { "$ref": "#/$defs/name", "description": "Explicit operator class (X01). Omitted = the method's default class for the type. pgvector indexes select distance semantics this way (vector_ops / vector_cosine_ops / vector_ip_ops)." }
                },
                "required": ["column"],
                "additionalProperties": false
              },
              {
                "type": "object",
                "properties": {
                  "expression": { "$ref": "#/$defs/sqlText" }
                },
                "required": ["expression"],
                "additionalProperties": false,
                "description": "Expression key parts cannot carry per-part ordering: per-part deparse is engine-dependent, so ordered expression keys are explicitly unsupported (validators reject order/nulls here)."
              }
            ]
          },
          "description": "Ordered key parts. Per-part ordering is stored in minimal form (Q07): order is written only for desc (asc is the default), nulls only when it is not the direction default (asc defaults to nulls last, desc to nulls first). This matches what introspection derives from pg_index.indoption, so desired and introspected documents canonicalize identically."
        },
        "where": { "$ref": "#/$defs/sqlText", "description": "Partial-index predicate, verbatim." },
        "include": {
          "type": "array",
          "items": { "$ref": "#/$defs/name" },
          "uniqueItems": true,
          "description": "Included columns (INCLUDE clause)."
        },
        "with": {
          "type": "object",
          "propertyNames": { "pattern": "^[a-z_][a-z0-9_]*$" },
          "additionalProperties": { "type": "integer" },
          "minProperties": 1,
          "description": "Access-method parameters (X01): with (m = 16, ef_construction = 64) on hnsw, with (lists = 100) on ivfflat, with (fillfactor = 90) on btree — introspected reloptions round-trip on any method. Integer values only (non-integer reloptions keep the index unrepresentable); the server validates the keys. Canonical form sorts the keys."
        }
      },
      "required": ["identity", "unique", "method", "key"],
      "additionalProperties": false
    },
    "table": {
      "type": "object",
      "properties": {
        "identity": { "$ref": "#/$defs/identity" },
        "managed": {
          "type": "boolean",
          "description": "Managed-scope metadata: whether this object is inside the managed scope of the workflow that produced the document. Desired documents declare their objects managed; introspected documents mark scope explicitly. Never inferred. A planner treats an object with managed: false as not its own: it never creates, alters or drops it, does not compare it, and does not report drift on it; a managed object may still reference it (for example a foreign key onto an unmanaged table)."
        },
        "columns": {
          "type": "array",
          "items": { "$ref": "#/$defs/column" },
          "minItems": 1,
          "description": "Ordered tuple: physical column order (PostgreSQL attnum) is part of the schema state. Two documents that differ only in column order are different schemas; canonicalization preserves the array verbatim."
        },
        "constraints": { "type": "array", "items": { "$ref": "#/$defs/constraint" } },
        "indexes": { "type": "array", "items": { "$ref": "#/$defs/indexDef" } }
      },
      "required": ["identity", "managed", "columns", "constraints", "indexes"],
      "additionalProperties": false
    },
    "enumDef": {
      "type": "object",
      "properties": {
        "identity": { "$ref": "#/$defs/identity" },
        "managed": { "type": "boolean" },
        "values": {
          "type": "array",
          "minItems": 1,
          "items": { "$ref": "#/$defs/name" },
          "uniqueItems": true,
          "description": "Ordered tuple: PostgreSQL compares enum values by declaration order."
        }
      },
      "required": ["identity", "managed", "values"],
      "additionalProperties": false
    },
    "view": {
      "type": "object",
      "properties": {
        "identity": { "$ref": "#/$defs/identity" },
        "managed": { "type": "boolean" },
        "definition": { "$ref": "#/$defs/sqlText", "description": "View body, verbatim." },
        "checkOption": { "enum": ["local", "cascaded"] },
        "securityInvoker": { "type": "boolean" }
      },
      "required": ["identity", "managed", "definition"],
      "additionalProperties": false
    },
    "opaqueEntry": {
      "type": "object",
      "properties": {
        "kind": {
          "enum": ["extension-table", "extension-object", "unsupported-table", "unsupported-object"],
          "description": "extension-*: owned by an installed extension. unsupported-*: a catalog structure this contract cannot yet represent faithfully."
        },
        "identity": { "$ref": "#/$defs/identity" },
        "owner": { "type": "string", "description": "Owning extension name when known." },
        "reason": { "$ref": "#/$defs/sqlText", "description": "Why the object is opaque. Human-facing, part of the canonical form." }
      },
      "required": ["kind", "identity", "reason"],
      "additionalProperties": false
    }
  }
}
