{"capabilities":[],"dialect":"postgresql","enums":[{"identity":{"name":"color","schema":"public"},"managed":true,"values":["red","green","blue"]}],"opaque":[{"identity":{"name":"monthly_rollup","schema":"public"},"kind":"unsupported-object","reason":"materialized views are not representable in this contract version"},{"identity":{"name":"spatial_ref_sys","schema":"public"},"kind":"extension-table","owner":"postgis","reason":"owned by extension postgis"},{"identity":{"name":"uuid_generate_v4","schema":"public"},"kind":"extension-object","owner":"uuid-ossp","reason":"extension-owned function"}],"schemas":[{"name":"public"}],"tables":[{"columns":[{"name":"name","notNull":true,"type":{"codec":"string","name":"text"}},{"name":"columns","notNull":true,"type":{"codec":"json","name":"jsonb"}},{"name":"type","notNull":false,"type":{"codec":"string","name":"text"}}],"constraints":[{"columns":["name"],"name":"indexes_pkey","type":"primary-key"}],"identity":{"name":"indexes","schema":"public"},"indexes":[],"managed":true},{"columns":[{"name":"id","notNull":true,"type":{"codec":"number","name":"int4"}},{"name":"columns","notNull":false,"type":{"codec":"string","name":"text"}},{"name":"identity","notNull":false,"type":{"codec":"string","name":"text"}},{"name":"version","notNull":false,"type":{"codec":"string","name":"text"}},{"name":"tint","notNull":false,"type":{"codec":"enum","enum":{"name":"color","schema":"public"},"name":"enum"}}],"constraints":[{"columns":["id"],"name":"meta_pkey","type":"primary-key"}],"identity":{"name":"meta","schema":"public"},"indexes":[],"managed":true}],"version":2,"views":[{"checkOption":"cascaded","definition":"select name from public.indexes where type = 'active'","identity":{"name":"v_active","schema":"public"},"managed":true,"securityInvoker":true},{"definition":"select count(*) as n from public.meta","identity":{"name":"v_meta_count","schema":"public"},"managed":false}]}