{"capabilities":[],"dialect":"postgresql","enums":[],"opaque":[],"schemas":[{"name":"public"}],"tables":[{"columns":[{"name":"id","notNull":true,"type":{"codec":"number","name":"int4"}},{"name":"name","notNull":true,"type":{"codec":"string","name":"text"}}],"constraints":[{"columns":["id"],"name":"branches_pkey","type":"primary-key"}],"identity":{"name":"branches","schema":"public"},"indexes":[],"managed":true},{"columns":[{"name":"id","notNull":true,"type":{"codec":"number","name":"int4"}},{"name":"account","notNull":true,"type":{"codec":"string","name":"text"}},{"name":"branch","notNull":true,"type":{"codec":"number","name":"int4"}},{"name":"rank","notNull":false,"type":{"codec":"number","name":"int4"}},{"name":"amount","notNull":true,"type":{"codec":"decimal-string","name":"numeric"}},{"name":"memo","notNull":false,"type":{"codec":"string","name":"text"}},{"name":"tags","notNull":false,"type":{"array":true,"codec":"array","name":"text"}}],"constraints":[{"expression":"amount >= 0","name":"ledger_amount_check","type":"check"},{"columns":["branch"],"name":"ledger_branch_fkey","references":{"columns":["id"],"match":"full","onDelete":"set null","onUpdate":"cascade","table":{"name":"branches","schema":"public"}},"type":"foreign-key"},{"columns":["account","branch"],"name":"ledger_pkey","type":"primary-key"},{"columns":["rank","account"],"deferrable":true,"initiallyDeferred":true,"name":"ledger_rank_account_key","type":"unique"}],"identity":{"name":"ledger","schema":"public"},"indexes":[{"identity":{"name":"ledger_amount_unq","schema":"public"},"key":[{"column":"amount","nulls":"first"}],"method":"btree","unique":true},{"identity":{"name":"ledger_memo_idx","schema":"public"},"include":["amount","branch"],"key":[{"column":"rank","order":"desc"},{"column":"memo","nulls":"first"},{"column":"rank","nulls":"last","order":"desc"},{"expression":"lower(memo)"}],"method":"btree","unique":false,"where":"memo is not null"},{"identity":{"name":"ledger_tags_gin","schema":"public"},"key":[{"column":"tags"}],"method":"gin","unique":false}],"managed":true}],"version":2,"views":[]}