{"capabilities":[],"dialect":"postgresql","enums":[],"opaque":[{"identity":{"name":"audit_chunk","schema":"app"},"kind":"extension-table","owner":"pg_partman","reason":"partitioned child table owned by pg_partman"}],"schemas":[{"name":"app"},{"name":"public"}],"tables":[{"columns":[{"name":"tenant_id","notNull":true,"type":{"codec":"number","name":"int4"}},{"name":"user_id","notNull":true,"type":{"codec":"number","name":"int4"}},{"name":"role","notNull":true,"type":{"codec":"string","name":"varchar","params":{"length":32}}}],"constraints":[{"columns":["tenant_id","user_id"],"name":"memberships_pkey","type":"primary-key"},{"expression":"length(btrim(role)) > 0","name":"memberships_role_check","type":"check"},{"columns":["tenant_id","user_id"],"deferrable":true,"initiallyDeferred":false,"name":"memberships_user_fkey","references":{"columns":["tenant_id","id"],"onDelete":"cascade","table":{"name":"users","schema":"public"}},"type":"foreign-key"}],"identity":{"name":"memberships","schema":"app"},"indexes":[{"identity":{"name":"memberships_user_idx","schema":"app"},"include":["tenant_id"],"key":[{"column":"user_id"}],"method":"btree","unique":false,"where":"user_id is not null"}],"managed":true},{"columns":[{"name":"org_id","notNull":true,"type":{"codec":"number","name":"int4"}},{"name":"dept","notNull":true,"type":{"codec":"number","name":"int4"}},{"name":"note","notNull":false,"type":{"codec":"string","name":"text"}}],"constraints":[{"columns":["org_id","dept"],"name":"org_settings_scope_key","type":"unique"}],"identity":{"name":"org_settings","schema":"app"},"indexes":[{"identity":{"name":"org_settings_note_idx","schema":"app"},"include":["dept","org_id"],"key":[{"column":"org_id"},{"expression":"lower(note)"}],"method":"btree","unique":false}],"managed":true},{"columns":[{"name":"id","notNull":true,"type":{"codec":"number","name":"int4"}}],"constraints":[{"columns":["id"],"name":"tenants_pkey","type":"primary-key"}],"identity":{"name":"tenants","schema":"public"},"indexes":[],"managed":true},{"columns":[{"name":"tenant_id","notNull":true,"type":{"codec":"number","name":"int4"}},{"name":"id","notNull":true,"type":{"codec":"number","name":"int4"}},{"name":"email","notNull":true,"type":{"codec":"string","name":"varchar","params":{"length":254}}},{"name":"name","notNull":false,"type":{"codec":"string","name":"text"}}],"constraints":[{"columns":["email"],"name":"users_email_key","type":"unique"},{"columns":["tenant_id","id"],"name":"users_pkey","type":"primary-key"},{"columns":["tenant_id"],"name":"users_tenant_fkey","references":{"columns":["id"],"onDelete":"cascade","table":{"name":"tenants","schema":"public"}},"type":"foreign-key"}],"identity":{"name":"users","schema":"public"},"indexes":[],"managed":true}],"version":2,"views":[]}