{"capabilities":[],"dialect":"postgresql","enums":[],"opaque":[],"schemas":[{"name":"public"}],"tables":[{"columns":[{"name":"title","notNull":true,"type":{"codec":"string","name":"text"}},{"name":"author_id","notNull":true,"type":{"codec":"number","name":"int4"}},{"name":"id","notNull":true,"type":{"codec":"number","name":"int4"}},{"default":{"kind":"literal","sql":"0"},"name":"views_count","notNull":false,"type":{"codec":"number","name":"int4"}}],"constraints":[{"columns":["author_id"],"name":"posts_author_id_fkey","references":{"columns":["id"],"onDelete":"cascade","table":{"name":"users","schema":"public"}},"type":"foreign-key"},{"columns":["id"],"name":"posts_pkey","type":"primary-key"}],"identity":{"name":"posts","schema":"public"},"indexes":[{"identity":{"name":"posts_author_idx","schema":"public"},"key":[{"column":"author_id"}],"method":"btree","unique":false}],"managed":true},{"columns":[{"name":"id","notNull":true,"type":{"codec":"number","name":"int4"}},{"default":{"kind":"expression","sql":"now()"},"name":"created_at","notNull":true,"type":{"codec":"timestamptz-string","name":"timestamptz"}},{"name":"email","notNull":true,"type":{"codec":"string","name":"varchar","params":{"length":255}}},{"name":"name","notNull":false,"type":{"codec":"string","name":"text"}},{"default":{"kind":"literal","sql":"true"},"name":"active","notNull":true,"type":{"codec":"boolean","name":"bool"}}],"constraints":[{"columns":["email"],"name":"users_email_key","type":"unique"},{"columns":["id"],"name":"users_pkey","type":"primary-key"}],"identity":{"name":"users","schema":"public"},"indexes":[{"identity":{"name":"users_name_idx","schema":"public"},"key":[{"column":"name"}],"method":"btree","unique":false}],"managed":true}],"version":2,"views":[]}