{"capabilities":["pgvector"],"dialect":"postgresql","enums":[],"opaque":[],"schemas":[{"name":"public"}],"tables":[{"columns":[{"name":"id","notNull":true,"type":{"codec":"number","name":"int4"}},{"name":"embedding","notNull":false,"type":{"codec":"vector","name":"vector","params":{"dimensions":3}}},{"name":"body","notNull":false,"type":{"codec":"tsvector","name":"tsvector"}}],"constraints":[{"columns":["id"],"name":"docs_pkey","type":"primary-key"}],"identity":{"name":"docs","schema":"public"},"indexes":[{"identity":{"name":"docs_body_gin","schema":"public"},"key":[{"column":"body"}],"method":"gin","unique":false},{"identity":{"name":"docs_embedding_hnsw","schema":"public"},"key":[{"column":"embedding","opclass":"vector_cosine_ops"}],"method":"hnsw","unique":false,"with":{"ef_construction":64,"m":16}},{"identity":{"name":"docs_embedding_ivfflat","schema":"public"},"key":[{"column":"embedding","opclass":"vector_ip_ops"}],"method":"ivfflat","unique":false,"with":{"lists":100}}],"managed":true}],"version":2,"views":[]}