{
    "version": 2,
    "dialect": "postgresql",
    "capabilities": [

    ],
    "schemas": [
        {"name": "public"}
    ],
    "tables": [
        {
            "identity": {"schema": "public", "name": "users"},
            "managed": true,
            "columns": [
                {"name": "id", "type": {"name": "int4", "codec": "number"}, "notNull": true},
                {"name": "created_at", "type": {"name": "timestamptz", "codec": "timestamptz-string"}, "notNull": true, "default": {"kind": "expression", "sql": "now()"}},
                {"name": "email", "type": {"name": "varchar", "codec": "string", "params": {"length": 2.55e2}}, "notNull": true},
                {"name": "name", "type": {"name": "text", "codec": "string"}, "notNull": false},
                {"name": "active", "type": {"name": "bool", "codec": "boolean"}, "notNull": true, "default": {"kind": "literal", "sql": "true"}}
            ],
            "constraints": [
                {"name": "users_email_key", "type": "unique", "columns": ["email"]},
                {"name": "users_pkey", "type": "primary-key", "columns": ["id"]}
            ],
            "indexes": [
                {"identity": {"schema": "public", "name": "users_name_idx"}, "unique": false, "method": "btree", "key": [{"column": "name"}]}
            ]
        },
        {
            "identity": {"schema": "public", "name": "posts"},
            "managed": true,
            "columns": [
                {"name": "title", "type": {"name": "text", "codec": "string"}, "notNull": true},
                {"name": "author_id", "type": {"name": "int4", "codec": "number"}, "notNull": true},
                {"name": "id", "type": {"name": "int4", "codec": "number"}, "notNull": true},
                {"name": "views_count", "type": {"name": "int4", "codec": "number"}, "notNull": false, "default": {"kind": "literal", "sql": "0"}}
            ],
            "constraints": [
                {"type": "primary-key", "name": "posts_pkey", "columns": ["id"]},
                {"type": "foreign-key", "name": "posts_author_id_fkey", "columns": ["author_id"], "references": {"columns": ["id"], "table": {"name": "users", "schema": "public"}, "onDelete": "cascade"}}
            ],
            "indexes": [
                {"unique": false, "method": "btree", "identity": {"schema": "public", "name": "posts_author_idx"}, "key": [{"column": "author_id"}]}
            ]
        }
    ],
    "enums": [],
    "views": [],
    "opaque": []
}
