{"capabilities":[],"dialect":"postgresql","enums":[],"opaque":[],"schemas":[{"name":"public"}],"tables":[{"columns":[{"default":{"generated":"always","kind":"identity"},"name":"id","notNull":true,"type":{"codec":"number","name":"int4"}},{"default":{"generated":"by default","kind":"identity"},"name":"revision","notNull":true,"type":{"codec":"bigint","name":"int8"}},{"name":"number","notNull":true,"type":{"codec":"string","name":"text"}},{"name":"net","notNull":true,"type":{"codec":"decimal-string","name":"numeric"}},{"generated":{"expression":"net * 1.19"},"name":"gross","notNull":false,"type":{"codec":"decimal-string","name":"numeric"}},{"generated":{"expression":"btrim(number)"},"name":"stamp","notNull":false,"type":{"codec":"string","name":"text"}}],"constraints":[{"columns":["id"],"name":"invoices_pkey","type":"primary-key"}],"identity":{"name":"invoices","schema":"public"},"indexes":[],"managed":true}],"version":2,"views":[]}