{"capabilities":["nucleus"],"dialect":"postgresql","enums":[],"opaque":[],"schemas":[{"name":"public"}],"tables":[{"columns":[{"default":{"kind":"sequence","sequence":{"name":"items_id_seq","schema":"public"}},"name":"id","notNull":true,"type":{"codec":"number","name":"int4"}},{"name":"embedding","notNull":true,"type":{"codec":"vector","name":"vector","params":{"dimensions":3}}}],"constraints":[{"columns":["id"],"name":"items_pkey","type":"primary-key"}],"identity":{"name":"items","schema":"public"},"indexes":[],"managed":true}],"version":2,"views":[]}